{
  "name": "anthropic.nonstream.native-tool-defer-loading-from-ir",
  "description": "IR request with native tool defer_loading encodes to Anthropic tool.",
  "spec_version": "0.2.0",
  "mode": "nonstream",
  "conversion": "from-ir",
  "source": {
    "protocol": "anthropic"
  },
  "target": {
    "protocol": "anthropic"
  },
  "input": {
    "specVersion": "0.2.0",
    "model": "claude-opus-5-5",
    "messages": [
      {
        "role": "user",
        "content": [
          {
            "type": "text",
            "text": "Call tool."
          }
        ]
      }
    ],
    "tools": [
      {
        "name": "lookup",
        "description": "Search DB.",
        "input_schema": {
          "type": "object"
        },
        "native": [
          {
            "source": "anthropic",
            "kind": "defer_loading",
            "value": "true",
            "omission": {
              "field": "defer_loading",
              "reason": "degraded",
              "detail": "deferred tool loading is a provider-side context-assembly instruction; the tool definition is unchanged and loads up front when the target has no tool search"
            }
          }
        ]
      }
    ],
    "params": {
      "max_tokens": 16000
    }
  },
  "expected_output": {
    "model": "claude-opus-5-5",
    "max_tokens": 16000,
    "messages": [
      {
        "role": "user",
        "content": "Call tool."
      }
    ],
    "tools": [
      {
        "name": "lookup",
        "description": "Search DB.",
        "input_schema": {
          "type": "object"
        },
        "defer_loading": true
      }
    ]
  },
  "expected_losses": [],
  "tags": [
    "request",
    "tools",
    "defer-loading",
    "native"
  ]
}
