{
  "name": "responses.nonstream.refusal-content-response-from-ir",
  "description": "IR RefusalBlock renders as a refusal content part and failed status with error code refusal.",
  "spec_version": "0.2.0",
  "mode": "nonstream",
  "conversion": "from-ir",
  "source": { "protocol": "responses" },
  "target": { "protocol": "responses" },
  "input": {
    "specVersion": "0.2.0",
    "id": "resp_refusal_from_ir",
    "model": "gpt-4o-mini",
    "content": [
      {
        "type": "refusal",
        "refusal": "I cannot fulfill this request."
      }
    ],
    "stop_reason": "refusal",
    "usage": { "input_tokens": 10, "output_tokens": 8 }
  },
  "expected_output": {
    "id": "resp_refusal_from_ir",
    "object": "response",
    "status": "failed",
    "error": { "code": "refusal", "message": "I cannot fulfill this request." },
    "model": "gpt-4o-mini",
    "output": [
      {
        "type": "message",
        "id": "msg_abc123",
        "status": "completed",
        "role": "assistant",
        "content": [
          {
            "type": "refusal",
            "refusal": "I cannot fulfill this request."
          }
        ]
      }
    ],
    "usage": { "input_tokens": 10, "output_tokens": 8, "total_tokens": 18 }
  },
  "expected_losses": [],
  "tags": ["response", "refusal", "n-r-20"]
}
