{
  "name": "responses.nonstream.apply-patch-call-create-file-completed-to-ir",
  "description": "N-AP-1..5：专用 Apply Patch 类型、关联、文本保真与原子流式。",
  "spec_version": "0.2.0",
  "mode": "nonstream",
  "conversion": "to-ir",
  "source": {
    "protocol": "responses"
  },
  "input": {
    "id": "r",
    "object": "response",
    "status": "completed",
    "model": "m",
    "output": [
      {
        "type": "apply_patch_call",
        "call_id": "c",
        "status": "completed",
        "operation": {
          "type": "create_file",
          "path": "../路径\\new.py",
          "diff": "+print(\"你好\")\r\n  \t\u0000"
        },
        "id": "apc_0"
      }
    ],
    "usage": {
      "input_tokens": 2,
      "output_tokens": 3,
      "total_tokens": 5
    }
  },
  "expected_losses": [],
  "tags": [
    "apply-patch",
    "n-ap-1",
    "n-ap-2",
    "n-ap-3",
    "n-ap-4",
    "n-ap-5",
    "response"
  ],
  "provenance": {
    "doc_url": "https://github.com/openai/openai-python/tree/e71d781ac5e7b3f365ac130bf338baaf13ae720d/src/openai/types/responses",
    "retrieved": "2026-10-16"
  },
  "expected_ir": {
    "specVersion": "0.2.0",
    "id": "r",
    "model": "m",
    "content": [
      {
        "type": "apply_patch_tool_use",
        "id": "c",
        "status": "completed",
        "operation": {
          "type": "create_file",
          "path": "../路径\\new.py",
          "diff": "+print(\"你好\")\r\n  \t\u0000"
        }
      }
    ],
    "stop_reason": "tool_use",
    "usage": {
      "input_tokens": 2,
      "output_tokens": 3
    }
  }
}
