{
  "name": "responses.stream.apply-patch-call-update-file-to-ir",
  "description": "N-AP-1..5：专用 Apply Patch 类型、关联、文本保真与原子流式。",
  "spec_version": "0.2.0",
  "mode": "stream",
  "conversion": "to-ir",
  "source": {
    "protocol": "responses"
  },
  "input": {
    "events": [
      {
        "type": "response.created",
        "response": {
          "id": "stream_call-update-file",
          "object": "response",
          "status": "in_progress",
          "model": "m",
          "output": []
        }
      },
      {
        "type": "response.output_item.added",
        "output_index": 0,
        "item": {
          "type": "apply_patch_call",
          "call_id": "c",
          "status": "in_progress",
          "operation": {
            "type": "update_file",
            "path": "C:\\work\\file.py",
            "diff": ""
          },
          "id": "apc_0"
        }
      },
      {
        "type": "response.output_item.done",
        "output_index": 0,
        "item": {
          "type": "apply_patch_call",
          "call_id": "c",
          "status": "completed",
          "operation": {
            "type": "update_file",
            "path": "C:\\work\\file.py",
            "diff": "not a valid diff\r\n-old\n+new\n  "
          },
          "id": "apc_0"
        }
      },
      {
        "type": "response.completed",
        "response": {
          "id": "stream_call-update-file",
          "object": "response",
          "status": "completed",
          "model": "m",
          "output": [
            {
              "type": "apply_patch_call",
              "call_id": "c",
              "status": "completed",
              "operation": {
                "type": "update_file",
                "path": "C:\\work\\file.py",
                "diff": "not a valid diff\r\n-old\n+new\n  "
              },
              "id": "apc_0"
            }
          ],
          "usage": {
            "input_tokens": 2,
            "output_tokens": 3,
            "total_tokens": 5
          }
        }
      }
    ]
  },
  "expected_losses": [],
  "tags": [
    "apply-patch",
    "n-ap-1",
    "n-ap-2",
    "n-ap-3",
    "n-ap-4",
    "n-ap-5"
  ],
  "provenance": {
    "doc_url": "https://github.com/openai/openai-python/tree/e71d781ac5e7b3f365ac130bf338baaf13ae720d/src/openai/types/responses",
    "retrieved": "2026-10-16"
  },
  "expected_ir": {
    "specVersion": "0.2.0",
    "events": [
      {
        "type": "message_start",
        "id": "stream_call-update-file",
        "model": "m"
      },
      {
        "type": "content_block_start",
        "index": 0,
        "block": {
          "type": "apply_patch_tool_use",
          "id": "c",
          "status": "completed",
          "operation": {
            "type": "update_file",
            "path": "C:\\work\\file.py",
            "diff": "not a valid diff\r\n-old\n+new\n  "
          }
        }
      },
      {
        "type": "content_block_stop",
        "index": 0
      },
      {
        "type": "message_delta",
        "stop_reason": "tool_use",
        "usage": {
          "input_tokens": 2,
          "output_tokens": 3
        }
      },
      {
        "type": "message_done"
      }
    ]
  }
}
