{
  "name": "chatcompletions.nonstream.verbosity-request-to-ir",
  "description": "Chat Completions verbosity maps to IR output verbosity.",
  "spec_version": "0.2.0",
  "mode": "nonstream",
  "conversion": "to-ir",
  "source": {"protocol": "chatcompletions"},
  "input": {"model": "m", "messages": [{"role": "user", "content": "Hi"}], "verbosity": "low"},
  "expected_ir": {"specVersion": "0.2.0", "model": "m", "messages": [{"role": "user", "content": [{"type": "text", "text": "Hi"}]}], "params": {"verbosity": "low"}},
  "expected_losses": [],
  "tags": ["request", "verbosity"]
}
